{
  "$schema": "https://json-schema.org/draft/2020-12/schema",
  "$id": "urn:archflow:schema:v1:task-initialization",
  "type": "object",
  "properties": {
    "schema_version": {
      "type": "string",
      "const": "1"
    },
    "artifact_kind": {
      "type": "string",
      "const": "task-initialization"
    },
    "task_id": {
      "$ref": "urn:archflow:schema:v1:primitives#/$defs/taskSlug"
    },
    "repository_identity_digest": {
      "$ref": "urn:archflow:schema:v1:primitives#/$defs/sha256Digest"
    },
    "code_baseline_commit": {
      "$ref": "urn:archflow:schema:v1:primitives#/$defs/gitOid"
    },
    "policy_base_commit": {
      "$ref": "urn:archflow:schema:v1:primitives#/$defs/gitOid"
    },
    "constitution_digest": {
      "$ref": "urn:archflow:schema:v1:primitives#/$defs/sha256Digest"
    },
    "workflow_digest": {
      "$ref": "urn:archflow:schema:v1:primitives#/$defs/sha256Digest"
    },
    "config_digest": {
      "$ref": "urn:archflow:schema:v1:primitives#/$defs/sha256Digest"
    },
    "canonical_paths": {
      "$ref": "urn:archflow:schema:v1:durable-primitives#/$defs/canonicalTaskPaths"
    }
  },
  "required": [
    "schema_version",
    "artifact_kind",
    "task_id",
    "repository_identity_digest",
    "code_baseline_commit",
    "policy_base_commit",
    "constitution_digest",
    "workflow_digest",
    "config_digest",
    "canonical_paths"
  ],
  "additionalProperties": false
}
