{
  "artifact_kind": "task-initialization",
  "canonical_paths": {
    "config": ".archflow/tasks/free-form-changes/config.yaml",
    "constitution_root": ".archflow/constitution",
    "state": ".archflow/tasks/free-form-changes/state.json",
    "task_root": ".archflow/tasks/free-form-changes",
    "workflow": ".archflow/workflow.yaml"
  },
  "code_baseline_commit": "a0052a260dbd86254cdd600187a6910617222220",
  "config_digest": "57926cd0251eeeb81854878f72b3af2e359f109d7dd2d0857fbd3e6e2f6c4676",
  "constitution_digest": "c75a16798a5a143c3bd117bdcbbb5a6ddc8cc1b1adcd584d802f154dfddcef1b",
  "policy_base_commit": "a0052a260dbd86254cdd600187a6910617222220",
  "repository_identity_digest": "5861ad3efec19d13e60f4b7476aea41151d4411b8b3fdd178038bc951a4778dc",
  "schema_version": "1",
  "task_id": "free-form-changes",
  "workflow_digest": "3f5f7536f19219fbf4ade78aea07c93d22d03057ce2ed83d532e25a54a8aab9a"
}
